"agreement","annotation_id","annotator","created_at","id","lead_time","sentiment","text","updated_at"
100.0,35619795,"20111","2024-05-02T06:39:28.223387Z","e6sriot",14.954,"belief","Why are you purposefully ignoring that eminem is 500x more popular than fucking pusha T for the sake of your self righteous argument? If say, Royal Blood dropped the best rock album of 2018 it wouldn't get near the traction of a good Radiohead album.  

I love hip hop but when r/hiphophead die hards come over to r/music they are cancer. They wanted r/music to ignore this so bad so they could bitch but it has like 10k upvotes lmao.","2024-05-02T06:39:28.223413Z"
100.0,35619809,"20111","2024-05-02T06:39:32.493670Z","e62gy2n",3.352,"belief","It's not really working out as planned. Seems the opposite.","2024-05-02T06:39:32.493685Z"
100.0,35619824,"20111","2024-05-02T06:39:35.745294Z","e5q47wf",2.531,"belief","Whats wrong with the story of 4? I get grypes with gameplay changes, a lot of people dont like change, but I felt the campaign was pretty good, and the ending *WAS* a good send-off to a character and a potential big change to the series.


5 campaign was garbo. Everything out of 343's mouth was a lie, the marketing was all bullshit, and nothing came out of the *fan-fucking-tastic* Hunt The Truth audio drama thing.","2024-05-02T06:39:35.745313Z"
100.0,35619832,"20111","2024-05-02T06:39:38.673640Z","e6adcv2",2.245,"non-belief","did you change to Eevee?","2024-05-02T06:39:38.673675Z"
100.0,35619906,"20111","2024-05-02T06:40:07.499950Z","e5ufxul",28.066,"non-belief","To add to that, also in California. 


[SB1100]([URL] is pending signature from Jerry Brown. restricts manufacture and purchase of firearms by adults under the age of 21. 


[AB2103]([URL] is also pending signature. Defines a statewide standard for concealed carry permit requirements. Current law restricts training to a maximum of 16 hours, new law leaves maximum in place but enforces a 8 hour training minimum and must include live fire training. 


[Sb1177]([URL] pending signature. 
Changes limit of 1 handgun transfer per 30 day period to 1 firearm transfer per 30 day period. 


[AB2888]([URL] signature. Allows the reporting of an individual by employers, coworkers, secondary school employees who have instructed said individual in the last 6 months and mental health workers who have the individual as a patient in the last 6 months. 


[Sb221]([URL] pending signature. Gut and amend, Bans gun shows at the cow palace starting 01/012020 



[Don't forget to register to vote in time for the elections!]([URL] Last day to register is 10/22/2018. Get everyone you know registered to vote, there is no excuse in California you can vote by mail. Deadline to apply for vote by mail status is 10/30.","2024-05-02T06:40:07.499970Z"
100.0,35619916,"20111","2024-05-02T06:40:11.198573Z","e5czgk9",2.345,"belief","Its a common condition in American society. Just like women were thrown in the woods during medieval times for their period until they were pure again.","2024-05-02T06:40:11.198593Z"
100.0,35619923,"20111","2024-05-02T06:40:13.877665Z","e65c1k9",1.929,"non-belief","I'm not taking sides, but the EU contributes about half of our immigration. We could, in theory (though almost definitely won't), block EU immigrants to the UK once we leave the EU. At the moment we can't do that. A lot of blue collar workers rightly or wrongly believe immigrants are costing them their jobs.

Like I said don't bite my head off, I am not taking sides here. I am just explaining the rationale of other leave voters from what I gather.

[URL]","2024-05-02T06:40:13.877684Z"
100.0,35619929,"20111","2024-05-02T06:40:16.556414Z","e64f5ny",19.393,"non-belief","The Browns are finding new inventive ways to Brown","2024-05-02T06:41:31.563674Z"
100.0,35620145,"20111","2024-05-02T06:41:43.730409Z","e6cp8qx",9.298,"non-belief","&gt; Edit: it was a joke y'all, how fucking high are you 

Fairly","2024-05-02T06:41:43.730428Z"
100.0,35620187,"20111","2024-05-02T06:42:01.466417Z","e6gcz8m",17.041,"non-belief","I've collected a few shineys here and there, I'll take them out of the bank and see if you want any of those? I don't really want to go down the buying route, I feel like it's a bit of a cop-out considering the amount of time I've put into getting this far!","2024-05-02T06:42:01.466435Z"
100.0,35620190,"20111","2024-05-02T06:42:04.144160Z","e5yrvjl",1.772,"non-belief","There isn't one - you'll find core groups of narcissists, psychopaths, etc. who oversee dependent underlings of whatever nature - ""autistics"", sycophants, lesser narcs/psychos, indifferent people, indoctrinated people, etc.","2024-05-02T06:42:04.144176Z"
100.0,35620201,"20111","2024-05-02T06:42:07.147482Z","e5dsite",2.283,"non-belief","That sounds like some kind of Harry Potter spell.","2024-05-02T06:42:07.147500Z"
100.0,35620210,"20111","2024-05-02T06:42:11.256734Z","e63k6kq",3.114,"non-belief","Needs to preach to them Martians.","2024-05-02T06:42:11.256751Z"
100.0,35620259,"20111","2024-05-02T06:42:28.289832Z","e613cs9",15.924,"non-belief","Oh yeah, I really agree. I don't think the part was really suited for her voice.  She did that tremolo on the high notes and it just didn't sound great after you hear it sung with a stronger voice.","2024-05-02T06:42:28.289852Z"
100.0,35620263,"20111","2024-05-02T06:42:31.105348Z","e6pnzsd",1.772,"non-belief","Just straight up eliminate Derrick, no lipsync","2024-05-02T06:42:31.105365Z"
100.0,35620269,"20111","2024-05-02T06:42:33.560703Z","e6728px",1.827,"non-belief","How is Ally? I don't know anyone who uses them but the savings account interest rates are pretty high so I've been thinking about opening an account. Just never dealt with an online bank before.","2024-05-02T06:42:33.560726Z"
100.0,35620300,"20111","2024-05-02T06:42:47.356370Z","e5jxw13",12.955,"non-belief","Explain to me how torrents have been shut down.","2024-05-02T06:42:47.356391Z"
100.0,35620316,"20111","2024-05-02T06:42:51.472353Z","e6mc3ea",2.16,"non-belief","well that's good, that would be incredibly inconvenient","2024-05-02T06:42:51.472370Z"
100.0,35620326,"20111","2024-05-02T06:42:55.065944Z","e5li4lg",2.239,"belief","This is the most pathetic thing I've ever seen. I have no social media other than reddit. Most of the time I don't even participate. I just read shit. If anyone got banned from reddit for any reason I wouldn't give a shit. If I disagreed enough I would stop using reddit. But you won't stop using social media and you'll make excuses for everyone else' crazy addiction to it because you think social media is a fucking utility (you don't really, you're just virtue signaling) when really you just can't stop using it. Grow the fuck up.","2024-05-02T06:42:55.065971Z"
100.0,35620333,"20111","2024-05-02T06:42:57.992546Z","e59v6dl",1.81,"non-belief","Dat reading comprehension. Try no starving and less waste &gt; starving because of waste.","2024-05-02T06:42:57.992567Z"
100.0,35620344,"20111","2024-05-02T06:43:01.144192Z","e6w9ur9",2.209,"non-belief","The car drives itself though.","2024-05-02T06:43:01.144214Z"
100.0,35620741,"20111","2024-05-02T06:45:36.494291Z","e5ihfjy",142.79,"belief","This made me seething mad. I cant believe you had to go through that, thats ridiculous.","2024-05-02T06:45:36.494313Z"
100.0,35620765,"20111","2024-05-02T06:45:43.686940Z","e6pxwgg",5.773,"non-belief","Schrodinger's Monsi_ggnore","2024-05-02T06:45:43.686958Z"
100.0,35620778,"20111","2024-05-02T06:45:47.190917Z","e5l9hxx",2.061,"belief","win one super bowl with a backup qb and they think theyre special","2024-05-02T06:45:47.190935Z"
100.0,35620788,"20111","2024-05-02T06:45:50.334980Z","e5lujij",2.198,"belief","Dragon Quest XI is a masterpiece and I felt like Ni No Kuni wasted my time. Both are aesthetically beautiful tho","2024-05-02T06:45:50.335012Z"
100.0,35620821,"20111","2024-05-02T06:46:05.103256Z","e5svqp5",13.921,"belief","because you're an asshole that just spews fat hate","2024-05-02T06:46:05.103274Z"
100.0,35620829,"20111","2024-05-02T06:46:07.434390Z","e6b9ovh",1.571,"belief","The jet sweep for one thing.  They. just. couldn't. see. it.  Or they knew it but couldn't stop it.  I thought that was our thing!","2024-05-02T06:46:07.434406Z"
100.0,35620837,"20111","2024-05-02T06:46:10.299126Z","e5qzik4",1.912,"belief","That's more of a problem with Electrocute being straight garbage in the jungle right now. It still works on laners though since lanes benefit from the changes to cooldowns. In the jungle it's more of a competition between Predator and DH where I'd argue that Pred is still very competitive since it deals decent damage and provides great utility.","2024-05-02T06:46:10.299142Z"
100.0,35620847,"20111","2024-05-02T06:46:13.034585Z","e5x0207",1.973,"belief","Agree.

I used to be Mycellium's biggest shill. 

They were supposed to turn into what Samourai is now.","2024-05-02T06:46:13.034613Z"
100.0,35620877,"20111","2024-05-02T06:46:25.874260Z","e5rkf5n",11.788,"non-belief","There are 50,000 or so Syrian refugees in Canada. You would expect from your stat that we would get .8 murders per year from that group. They have been here around 3 years. That means we should have had 2.4 by now. This is the only one I have heard about. You?","2024-05-02T06:46:25.874281Z"
100.0,35620885,"20111","2024-05-02T06:46:28.822980Z","e6781c8",1.876,"non-belief","I meant plaintiff, my mistake. Of course there's always multiple parties in a conflict, that's a given. What I said, is naming the plaintiff ""People"" is very US/UK centric, that's not at all common in other Roman justice law system, mainly because there's no such thing as a class action. 

I never said it is not derived from that. I'm saying it goes above that. But I guess it's all imagination, confusion and all that. I have no interest in continuing that discussion if that's your opinion even though it's a very narrow view on the evolution of the law from where I stand.","2024-05-02T06:46:28.822995Z"
100.0,35620893,"20111","2024-05-02T06:46:31.433358Z","e5qjcqz",1.819,"belief","You think that's bad? We had a tone of international students talking during a midterm exam last semester, no one did anything about it and they never even tried to defend their behaviour. The prof's response was even worse. Everyone lost respect for the class and stopped coming after that.","2024-05-02T06:46:31.433377Z"
100.0,35620899,"20111","2024-05-02T06:46:33.745981Z","e6adtnk",1.679,"non-belief","Are you saying that snickers with almonds is all a mars bar is, or they just reused the almond snickers name for what was originally a mars bar? (I had to reword it a few times for it to hopefully make sense)","2024-05-02T06:46:33.745999Z"
100.0,35620947,"20111","2024-05-02T06:46:55.800871Z","e5qebdw",21.333,"belief","Your comparison doesn't work, to be honest.

You have to remember that we live in an era where information is a lot more accessible (depending on where you live, but for the sake of argument, let's assume that it's a 1st world country). If an adult made the conscious decision to hate a group of people while choosing to ignore any and all evidence that the group isn't filled with bad people and refuse to educate themselves on the matter, then they are willingly choosing to be ignorant. Notice how I said adult.

Not only is Gabi a child in the prime time of her life where her brain easily molded, she also has no way to educate herself on whether the islanders are as bad as Marley is making them out to be. Reiner was the only person who could do that for her and he didnt. Eren killing her friends and family als ol certainly didn't do any favors. 

If you saw a racist kid, would you hate the kid or whoever sheltered the kid enough to make them become the way they are?","2024-05-02T06:46:55.800887Z"
100.0,35620959,"20111","2024-05-02T06:46:59.119688Z","e69oa44",2.599,"belief","&gt; cost of living is lower, and taxes are lower

Don't really think you can make a blanket statement like this - it's very location dependent.

The council/property tax on my home in NJ is triple that of my place in the UK. Utilities are more expensive, cell phone more expensive etc. My Wife works in central Philly so there's another 4% income tax just for that. How about medical premiums as well (I'm actually in a good spot there personally but I have friends paying $20,000/yr in just premiums).","2024-05-02T06:46:59.119712Z"
100.0,35620990,"20111","2024-05-02T06:47:13.813526Z","e5ri37o",14.066,"non-belief","Jesus just buy some boots or waders next time","2024-05-02T06:47:13.813545Z"
100.0,35620997,"20111","2024-05-02T06:47:16.191862Z","e6kxl6d",1.543,"non-belief","Spoken like a true kiwi...brings a tear to my eye!","2024-05-02T06:47:16.191882Z"
100.0,35621001,"20111","2024-05-02T06:47:18.533465Z","e5xjr98",1.526,"belief","That would help science, too.  By the time it gets to peer review, bad methods already screw it up","2024-05-02T06:47:18.533482Z"
100.0,35621006,"20111","2024-05-02T06:47:21.248572Z","e5cl7kp",1.808,"non-belief","Still have my T420s, going on 6 and a half years now!","2024-05-02T06:47:21.248591Z"
100.0,35621069,"20111","2024-05-02T06:47:42.003892Z","e58refo",19.941,"belief","Any decent person would praise her had she slapped him as a response. Is the world really full of such shitty people?","2024-05-02T06:47:42.003912Z"
100.0,35621078,"20111","2024-05-02T06:47:44.507436Z","e6gzd5x",1.547,"non-belief","Theres a way to play the main quest lines so that you almost never have to backtrack. I did it my first play through entirely by accident because I was new to rpgs and I took everything really slow. I wouldnt leave a city until I had talked to everyone. Then I would just go to the next location that held the most main objectives. 

If you wait to travel somewhere until theres more than one reason to go youll get a lot more done in a shorter amount of walking.","2024-05-02T06:47:44.507454Z"
100.0,35621087,"20111","2024-05-02T06:47:47.448160Z","e6jevpk",1.708,"non-belief","That's why everyone gets their comments removed. It doesn't stop them from saying it.","2024-05-02T06:47:47.448177Z"
100.0,35621092,"20111","2024-05-02T06:47:49.918704Z","e699j9f",1.869,"belief","if you legit think the weird beard song was better something is wrong with your head","2024-05-02T06:47:49.918727Z"
100.0,35621113,"20111","2024-05-02T06:48:02.417504Z","e57lvat",11.35,"non-belief","What is it about inhaled anesthetics that make it so we can't pinpoint their mechanism of action? It's still a chemical entering the body right? And inhaled substances can pass the BBB can't they? So what's stopping us from figuring out how they work? Seems to me it would work the same, and basically just as fast, as something injected into a vein.","2024-05-02T06:48:02.417535Z"
100.0,35621121,"20111","2024-05-02T06:48:05.590253Z","e6xg3h7",2.36,"belief","In the bible faith is defined as the evidence of things not seen. But that's impossible. There is no reason to accept that definition. It makes no rational sense. 

What do you think faith is then? And if you don't use it to define ""believing something without evidence or good reason"" then what word can be used for that definition?

&gt;Just know that unjustified belief is not what Christians mean by faith.

But they use faith to describe their unjustified belief. Do you not see what I'm pointing out?

&gt;You can have unjustified belief or justified belief and not have faith.

You cannot have a justified belief AND faith. They are not compatible. 

Faith is what you use when you having nothing else. When you have no evidence, no good reason to believe something people use faith to try and justify holding irrational beliefs. 

That is true, people do that. I won't speak for you, but many people literally do this.","2024-05-02T06:48:05.590273Z"
100.0,35621126,"20111","2024-05-02T06:48:08.420738Z","e6xmznd",2.131,"non-belief","Kids show up with adults and zero documentation. Many are brought in by human traffickers to become sex slaves. What do you do if you have no way of knowing they are with their parents? Hope for the best?","2024-05-02T06:48:08.420767Z"
100.0,35621131,"20111","2024-05-02T06:48:11.707889Z","e674ozh",2.183,"non-belief","CA, GA, &amp; ID

[URL]","2024-05-02T06:48:11.707908Z"
100.0,35621162,"20111","2024-05-02T06:48:27.398973Z","e6abc0t",14.393,"non-belief","Another Spokanite checking in","2024-05-02T06:48:27.399000Z"
100.0,35621168,"20111","2024-05-02T06:48:30.307111Z","e6porpm",1.908,"non-belief","at least u learnt it now!!! no more heartbreaks!","2024-05-02T06:48:30.307130Z"
100.0,35621173,"20111","2024-05-02T06:48:33.128426Z","e6dulji",2.142,"belief","My 50 years later line was simply to emphasize that it was one of the founders clarifying the language close to the time period that it was written. 

This clarification should be given a lot of weight.","2024-05-02T06:48:33.128446Z"
100.0,35621179,"20111","2024-05-02T06:48:35.643352Z","e65d3oh",1.771,"non-belief","I know. Kanye didnt blow up until 2004. Lil Wayne was a low level rapper, dropped that single Way of Life around that time frame. He didnt blow up until 2007 going until 2008. Drake obviously came around in the very late 2000s. People in here are young as fuck. Drake wasnt even thought of in 2002. He was on Teennick.","2024-05-02T06:48:35.643369Z"
