"agreement","annotation_id","annotator","created_at","id","lead_time","sentiment","text","updated_at"
100.0,35615760,"20111","2024-05-02T06:01:13.136531Z","e651y5k",4.826,"belief","You're just privileged","2024-05-02T06:01:13.136550Z"
100.0,35615780,"20111","2024-05-02T06:01:29.056495Z","e59xkgh",15.046,"belief","I wasn't saying that it was weird, I was just saying once you figure out the few things in life that you really only care about such as a girlfriend/wife, hobbies, job, classes, then stupid stuff like what happened to OP feels way less significant than when you're in highschool and care about your image a lot more","2024-05-02T06:01:29.056514Z"
100.0,35615882,"20111","2024-05-02T06:03:32.504667Z","e6v3h7b",122.638,"non-belief","The 30 shekels Judas received would have been about a year's wages, so 50 would have been a good amount","2024-05-02T06:03:32.504688Z"
100.0,35615941,"20111","2024-05-02T06:04:32.223414Z","e6ob8z7",58.995,"belief","Literally nothing is taken away from Solaires character or narrative because I knew how to do the quest.","2024-05-02T06:04:32.223430Z"
100.0,35616042,"20111","2024-05-02T06:06:00.496493Z","e6i9vz5",73.048,"non-belief","Well I used to work as a store clerk so I guess so ...","2024-05-02T06:06:00.496510Z"
100.0,35616081,"20111","2024-05-02T06:06:43.328808Z","e5gcog3",42.086,"belief","Having Al fight Lee makes perfect sense. They get to capitalize off of Iaquintas recent acquisition of name value, basically people know who he is if you bring up his name, and it has a pre-written storyline for Kevin to work off of with his trash talk. The UFC is trying to build new stars (which hasn't happened since it was bought) and Kevin is a solid contender for that new star position. 

From a business standpoint, this fight is one of the best (realistic fights) in the division right now for building Kevins star.","2024-05-02T06:06:43.328823Z"
100.0,35616089,"20111","2024-05-02T06:06:48.286812Z","e5hm85v",4.245,"non-belief","It's only defamation if it's not true.","2024-05-02T06:06:48.286831Z"
100.0,35616093,"20111","2024-05-02T06:06:53.058413Z","e5t3alz",4.011,"non-belief","Are you setting the record straight when your friends tell you this?","2024-05-02T06:06:53.058432Z"
100.0,35616097,"20111","2024-05-02T06:06:55.887094Z","e5olg10",2.198,"non-belief","No problem my dude.","2024-05-02T06:06:55.887112Z"
100.0,35616104,"20111","2024-05-02T06:07:02.165198Z","e58co5u",5.454,"belief","Is this really that normal? I don't think it is :/","2024-05-02T06:07:02.165219Z"
100.0,35616166,"20111","2024-05-02T06:07:53.072251Z","e6csqwd",50.164,"belief","0 cups in the modern era. Considering the age of the franchise, thats really bad. Miserable history, ummmm yeah about that, 50 year drought?","2024-05-02T06:07:53.072273Z"
100.0,35616224,"20111","2024-05-02T06:08:56.663325Z","e5dvw9y",62.792,"belief","No no. You misunderstand. Valid and exist are two differently defined words. The arguments do exist and they can be valid to the people arguing them, but when you apply logic along with evidence to them, they reveal that the motives and reasoning behind them are nothing more than petty inconsistent misinterpretations of American law and principles.

If YOU can find an argument from the conservative side that doesn't rely heavily on people's emotions and actually provides some solid interpretation of the law that shows that occupational retaliation, conviction, or threats of the aforementioned are fair decisions, then I would agree that there are some valid arguments.","2024-05-02T06:08:56.663340Z"
100.0,35616232,"20111","2024-05-02T06:09:02.273778Z","e5f4mtw",4.842,"non-belief","2K is not owned by Bethesda, it's not even owned by Zenimax. What are you talking about?","2024-05-02T06:09:02.273799Z"
100.0,35616241,"20111","2024-05-02T06:09:15.362358Z","e5qznaz",12.108,"non-belief","move to so cal. every bro wears sandals and pants every day","2024-05-02T06:09:15.362384Z"
100.0,35616264,"20111","2024-05-02T06:09:36.994441Z","e6u0pkm",20.984,"belief","Yes i agree, but the bottom line is that it does not matter. If you eliminate the most obvious things that enhance sexuality, then the attention will shift to more subtle signs like shapes, collarbones, waist, etc. I also want to point out that most workplaces have dress codes and that women are even required to enhance their sexuality to appear more professional by wearing makeup and heels. I think it is messed up, but at the same time I'm psychologically inclined to view these women as more professional than those who do not wear makeup and heels. Do you think attractive = professional in the business world? It sure appears so. I think if we eliminated those requirements for women then the focus would shift and plain women would start to appear more attractive and professional.","2024-05-02T06:09:36.994458Z"
100.0,35616291,"20111","2024-05-02T06:09:57.070735Z","e5abamw",19.376,"belief","**Index of Economic Freedom**

The Index of Economic Freedom is an annual index and ranking created in 1995 by The Heritage Foundation and The Wall Street Journal to measure the degree of economic freedom in the world's nations. The creators of the index took an approach similar to Adam Smith's in The Wealth of Nations, that ""basic institutions that protect the liberty of individuals to pursue their own economic interests result in greater prosperity for the larger society"".

***

^[ [^PM]([URL] ^| [^Exclude ^me]([URL] ^| [^Exclude ^from ^subreddit]([URL] ^| [^FAQ ^/ ^Information]([URL] ^| [^Source]([URL]   ^]
^Downvote ^to ^remove ^| ^v0.28","2024-05-02T06:09:57.070752Z"
100.0,35616322,"20111","2024-05-02T06:10:27.231622Z","e59x051",29.046,"belief","looks fake to me. The boston dynamics robts usually have tethers, at the very least theyre tested in a more controlled environment than just some office with people working in it.","2024-05-02T06:10:27.231638Z"
100.0,35616332,"20111","2024-05-02T06:10:35.415869Z","e6rmf3a",7.47,"non-belief","Great insight. Very interesting extension of the laws.","2024-05-02T06:10:35.415888Z"
100.0,35616339,"20111","2024-05-02T06:10:42.223083Z","e5y057g",6.184,"belief","It suffered from far more than that.","2024-05-02T06:10:42.223106Z"
100.0,35616355,"20111","2024-05-02T06:11:07.622592Z","e6wnjzi",24.595,"belief","&gt; Something is unbalanced imo if its execution takes less skill than any of its possible counters

this cases happened with all races across all game iterations, so I don't really think balance should be mentioned discussing that, unless winrates virate heavily in favor of a specific race for a significative span of time (like in blink all-in era, or roach-ravager all-ins on some early LotV maps) and ofc in that case devs would address the issue. also, all-ins have by no means ever been ""no risk tactics"", if you consider going mass adept/glaive a no risk tactic in a pro game you simply have no idea about Protoss play at that level

also, the idea that ""skill"" should be the only way to get a deserved win is a common misconception, mostly feeded from personal ladder experience and/or frustration, that should be neglected as soon as one realises that micro-tournament is just a custom game and not the 1v1 version of Starcraft played in official competition. in my opinion Starcraft is cool because you can master top level play with different sets of ""skills"" like controlling units, having better mechanics, tricking opponents, metagaming them etc. it leaves room for the best players to develop they're own playstyle accordingly with the skills they have

ofc, this is only my opinion, and all opinions are just opinions. no problem with that.","2024-05-02T06:11:07.622610Z"
100.0,35616393,"20111","2024-05-02T06:11:52.659620Z","e6mjhrq",44.429,"non-belief","Yeah, then I could pay one of my monthly bills *comfortably*(for one month)! Oh baby I love the trickle down effect","2024-05-02T06:11:52.659636Z"
100.0,35616425,"20111","2024-05-02T06:12:34.657942Z","e5t126n",41.191,"belief","Exchanging notes with students who are in your current class and purchasing notes so you don't have to go to class are very different things. One of them assumes at least positive intentions of going to class and attempting to do the work. The other assumes you are trying to get out of as much as possible.","2024-05-02T06:12:34.657961Z"
100.0,35616464,"20111","2024-05-02T06:13:28.588412Z","e69t7ev",53.082,"belief","I have an excessively toxic mother who buries me all the time with insults and it really messed my sense of self worth. I feel being raised in the right environment and social group can alleviate it. My self esteem is finally rising a notch due to therapy","2024-05-02T06:13:28.588435Z"
100.0,35616473,"20111","2024-05-02T06:13:42.178250Z","e6350xm",12.855,"belief","It still feels like we didnt get enough Kenny ): you can never get enough Kenny","2024-05-02T06:13:42.178266Z"
100.0,35616479,"20111","2024-05-02T06:13:45.295448Z","e580eje",2.356,"non-belief","Thank you!","2024-05-02T06:13:45.295465Z"
100.0,35616485,"20111","2024-05-02T06:13:51.995831Z","e5zffg0",5.949,"non-belief","If they die, there's often still a manhunt because the body is often not effortless to find.","2024-05-02T06:13:51.995851Z"
100.0,35616500,"20111","2024-05-02T06:14:04.799545Z","e69jpuz",12.016,"non-belief","Oh my god, my husband and I had a server tell us they were cutting us off after a cheat day of epically stoned proportions. It was also at all you can eat place-maybe in the future I'll just order booze when they look at me like they're ashamed to have me in their restaurant.","2024-05-02T06:14:04.799566Z"
100.0,35616569,"20111","2024-05-02T06:15:24.596948Z","e5kzqab",79.159,"belief","&gt; I feel like there are tons of lords in Westeros who would do exactly the same, though, totally not expecting someone to retaliate.

Tywin and his army do exactly that by herding smallfolk into working in Harrenhal because the original household left before the castle was taken.","2024-05-02T06:15:24.596969Z"
100.0,35616585,"20111","2024-05-02T06:15:39.742382Z","e5d0q6u",14.456,"non-belief","It makes you the killer of Jesse James......","2024-05-02T06:15:39.742406Z"
100.0,35616604,"20111","2024-05-02T06:16:01.525171Z","e6q6o2q",20.809,"non-belief","hanspanzer.am thoroughly awed with your reco book: The Bitcoin standard.many many lessons here brother.thanks.","2024-05-02T06:16:01.525196Z"
100.0,35616621,"20111","2024-05-02T06:16:19.011082Z","e67t8gp",16.696,"belief","But so would the current owner. The current owner is under no obligation to trade him. If he wants an RB1 to replace a guy that could win you the playoffs, thats his prerogative.","2024-05-02T06:16:19.011101Z"
100.0,35616647,"20111","2024-05-02T06:16:47.010714Z","e5lvdpv",27.343,"belief","I doubt you have two brain cells to rub together.","2024-05-02T06:16:47.010731Z"
100.0,35616704,"20111","2024-05-02T06:17:44.142613Z","e5krn56",56.479,"non-belief","Does it not do much or does it literally help calm you down?  

Not sure what to say about the first but the second part of the question is a question asked to me during my ADHD screening. 

Along with that, if the more you drink the sleepier or ""more zombie"" like you feel that is also a symptom of ADHD. 

&gt;I get a much better burst of energy by drinking, particularly while being constantly stimulated, such as while playing video games

yea, not saying you have adhd but you definitely might want to get screened.

- Do you have hyperfocus on things you are super duper into?  Like nothing can break your focus on that one item?  Do you start playing video games and next thing you know its 5 hours later and you havent eaten, had anything to drink, or didnt go to the bathroom?  

- Do you jump from hobby to hobby?  Researching everything and buying all the kits/accessories/newest fad item in hobby community only to lose complete interest a few months later?  

- do you sometimes wonder if you will ever find your ""true"" hobby that you can stick with? 

- Do you often feel the ""filter"" on your mouth is a second or two too slow?  Every tell yourself to stop saying something in the middle of saying it and cant stop?  

- Do you get overwhelmed by cleaning because you move from one cleaning task to another without getting anything done?  

- Do you make bad impulsive decisions when it comes to finances? 

- Do you space out when someone is talking to you but still understand what they said because its like you are superhuman when it comes to context clues?  

- Are your emotions, specifically anger and love, harder to control than your peers?

- are you told or feel you are immature because you cant do things like keep a clean house, not put your foot in your mouth, not stick to a budget, forget things you were told to do 10 minutes ago, procrastinate till the last second? 

- do you do your best work under the gun when you are full of adrenaline?  

- when problem solving do you have a hard time going from step a, to b, to c, ect but seem to be able to jump from A to Z better than most around you? 

- do your thought processes ever seem like they go ""look at that cute squirrel, they like nuts, man I could go for a peanut butter jelly sandwich, ITS PEANUT BUTTER JELLY TIME, po-ta-toes boil em mash em stick em in a stew, fuck me I need to focus, just one more video, oh that looks like an interesting hobby, lets shop around amazon for 10 minutes and go back to work, fuck its 3 hours later.""  

- does it feel like you have 50 TV's and 50 radio stations playing through your head at once? 

- Lastly, [read this comment from a long time ago,]([URL] and see if you relate to it at all. 

If you deal with a lot or even some of these you definitely might want to talk to a doctor about the issue.","2024-05-02T06:17:44.142633Z"
100.0,35616723,"20111","2024-05-02T06:18:01.870864Z","e5jkae0",17.073,"belief","Okay, boycotting Sony now... I haven't played video games in years, and the last Xperia I used turned out to be a piece of shit that broke in a year. So good riddance","2024-05-02T06:18:01.870882Z"
100.0,35618954,"20111","2024-05-02T06:34:40.089604Z","e68vtps",71.514,"belief","Oh, don't act like the Democratic party was all candy canes and rainbows by allowing Sanders to run on their ticket at all. He has voted with Democrats 99 percent of the time and the only way he is truly different from them is that he is more liberal and never gave up the Democratic parties original roots as an anti-war party. Him running as a Democrat was strategic of him yes, but he is not ""not a Democrat"". Furthermore, his beliefs and voting base are ""Democrats"". If you think the DNC was going to tell him "" No"", you can't run as a Democrat, you're deluded. They used him as much as he used them. They were NOT going toet him run as an independent where they couldn't themselves harness his voters, which are largely, *their* voters.","2024-05-02T06:34:40.089622Z"
100.0,35619048,"20111","2024-05-02T06:35:14.647086Z","9ghqnx",33.356,"belief","I will never get why guys fap if they have a gf some of us wish we had girlfriends to stop faping, Im about to go on day 8 btw I feel mentally stronger and confident not allot but way better than day 1 also I watch porn on day 6 but I did not jerk off although I naturally relapse a lil bit but I did not use my hands or anything to cause it I feel like I have no problem with jerking off Im not tempted to and now the battle field is going to be waged against porn and lustfull thoughts.","2024-05-02T06:35:14.647107Z"
100.0,35619060,"20111","2024-05-02T06:35:18.794176Z","e6coja3",3.268,"non-belief","The singer from Trivium does something like this.  He streams fortnite a lot, but other times hes doing warm ups or giving advice on playing guitar.","2024-05-02T06:35:18.794195Z"
100.0,35619102,"20111","2024-05-02T06:35:34.047329Z","e5gqetw",14.424,"non-belief","Just saying.","2024-05-02T06:35:34.047347Z"
100.0,35619117,"20111","2024-05-02T06:35:39.450585Z","e5hlx3d",4.628,"non-belief","Yes but I also took Royce freeman in the 4th. Seriously Todd Gurley (90 yards) and Kareem hunt (80 yards) are the only RBs who had success against them last year.

Edit: Seattles defense is going to suck this year. I can see Denver relying on their defense and giving Royce 20 plus touches week 1.","2024-05-02T06:35:39.450606Z"
100.0,35619130,"20111","2024-05-02T06:35:42.934876Z","e6k5qn5",2.769,"belief","When fringe groups bent on violence/racism/oppression appear, such as Gamer Gate, the Proud Boys, and the alt-right, there seems to be a somewhat dismissive reaction that can basically be summed up as ""Look at these silly, impotent virgins"" (see /r/beholdthemasterrace for a reddit example).

Recently, however, some such as Senior Vice gaming report Patrick Klepak have come out and said that perhaps dismissing Gamer Gate allowed it to grow into something that, for a time at least, had real impact on people's lives, spread a lot of hate, and caused a lot of pain.

As someone who has been close to these figures and sexually intimate with them, and how has experience as a sex worker, do you think the dismissal of these fringe hate groups is helpful or hurtful? Do you think there is a connection between sexual frustration and joining such a group? Do you find you have sex work clients that fit this pattern?","2024-05-02T06:35:42.934898Z"
100.0,35619160,"20111","2024-05-02T06:35:51.783607Z","e57gynm",8.133,"non-belief","First game I ever played on pc, I miss how busy it was like 14 years ago :(","2024-05-02T06:35:51.783628Z"
100.0,35619210,"20111","2024-05-02T06:36:11.440728Z","e6rynyn",18.926,"belief","careful, there's a lot felon cultists around here","2024-05-02T06:36:11.440748Z"
100.0,35619217,"20111","2024-05-02T06:36:14.285613Z","e698sng",2.137,"belief","Your response is legit. Not that you need to hear my accolade, however, reading your response made me feel pretty good because I, too, have read this tome and took from it your description.

Awesome! I have been waiting 17 years to talk about this book! I was reading it at the same time I lost my virginity. LOL. She was mad I was giving this book, of all books, more attention than I was giving her. Motherfucking Plato got me laid. See ya later, Virgins!","2024-05-02T06:36:14.285630Z"
100.0,35619231,"20111","2024-05-02T06:36:16.820876Z","e5ev1pw",1.746,"belief","&gt;Nah man. Sounds to me like you just didn't have real friends.

yeah right bud. move on. we're not going to come to any agreement. My experience and that of others I've spoken with in real life and online don't match that of you and your rich buddy. I can accept that you live the exception. I didn't (on more than one occasion) and others haven't.

Maybe it's time for *you* to learn to read.","2024-05-02T06:36:16.820895Z"
100.0,35619260,"20111","2024-05-02T06:36:28.364994Z","e66mptk",10.679,"non-belief","Youre right, that guy was a troll. No need to justify yourself to him. Thanks for fighting the good fight.","2024-05-02T06:36:28.365014Z"
100.0,35619304,"20111","2024-05-02T06:36:42.517817Z","e6oikjw",13.067,"non-belief","Mozilla achieves a similar result via a slightly different means (i.e. having no financial incentives at all), but they cancelled their OS and don't have an email service. Firefox is great though!","2024-05-02T06:36:42.517841Z"
100.0,35619316,"20111","2024-05-02T06:36:45.435187Z","e5so6gz",1.816,"non-belief","Put me down for Vincent, lol. I almost skipped getting him but I couldn't beat a boss battle in that area so I finally went back and got him. Beat that boss my next try.

Advent Children just amplified it to the next level.","2024-05-02T06:36:45.435207Z"
100.0,35619326,"20111","2024-05-02T06:36:48.456827Z","e6mgijk",2.235,"non-belief","yeah,  that's gotta be the most excruciating part of your testing products I imagine,  yet ANOTHER BB styled tank etc or whatever,  some aren't horrible,  but most are nothing you are gonna be over the moon with and buy more of.... and you just use the thing until the provided coils are killed and on the shelf it goes or whatever...  oh well... trying to think of the best ""kit"" tank...  hmmm....","2024-05-02T06:36:48.456848Z"
100.0,35619335,"20111","2024-05-02T06:36:51.672208Z","e6aszho",2.42,"belief","And once you give them the coins they shank you in the kidneys","2024-05-02T06:36:51.672231Z"
100.0,35619450,"20111","2024-05-02T06:37:30.501072Z","e6mgorb",13.175,"non-belief","Wow thats like $30k per American. When do they mail out the checks?","2024-05-02T06:37:30.501093Z"
100.0,35619454,"20111","2024-05-02T06:37:33.101171Z","e68d731",1.913,"belief","You are definitely in the minority","2024-05-02T06:37:33.101191Z"
100.0,35619506,"20111","2024-05-02T06:37:51.309762Z","9ihtbg",16.892,"non-belief","Hey reddit my sister referred me here because she got some good advice that helped her save her relationship so here I am needing the same


This is no ones fault but my own I fucked up big time by saying something a woman should never say to their man. Both of us were really drunk and really stoned and we were getting into it, he asked if I wanted something big and for some stupid fucking reason I don't understand why but I said that something bigger would be really nice to be honest, it just came out I have no idea why. The statement rings true, yes, him having a bit of a bigger dick would be nice but I never thought his dick wasn't good enough, else I wouldn't be married to him.


Since then 3 weeks ago every form of intimacy is dead; vocal, physical and sexual. We have a garage which is just his play room and since that night he's spent a majority of his time at home in there avoiding me. He can't trust anything I say to try and make it right because my attempts feel forced to him. He feels like he's not good enough, like he was settled for and like everytime I enjoyed sex with him was faked. Which is not true I have always enjoyed sex with him, if that wasn't the case I would never have married him.","2024-05-02T06:37:51.309779Z"
100.0,35619516,"20111","2024-05-02T06:37:55.519060Z","e6n6ywf",3.233,"non-belief","Sorry mate, I confess I don't know who you're talking about.","2024-05-02T06:37:55.519081Z"
100.0,35619555,"20111","2024-05-02T06:38:06.054040Z","e5i3k9b",9.476,"non-belief","Came here to say this. :3 Glad others appreciate them so much, too. They're so gorgeous (also, yay for scavengers!)","2024-05-02T06:38:06.054061Z"
100.0,35619566,"20111","2024-05-02T06:38:08.720347Z","e60vy2l",1.763,"belief","Those people are like the people who actually have celiac disease compared to those who claim to have ""gluten sensitivity"". My point is this phenomenon is probably fairly rare.","2024-05-02T06:38:08.720366Z"
100.0,35619573,"20111","2024-05-02T06:38:11.748275Z","e5kmhyz",2.089,"non-belief","I've always used: You have 2 **S**coops of ice cream for de**ss**ert.","2024-05-02T06:38:11.748294Z"
100.0,35619581,"20111","2024-05-02T06:38:14.599792Z","e69alxj",1.872,"belief","His song with Rihanna is very powerful about abusive relationships in my opinion. Theres some great flow and rhymes and I really enjoy it. A collaboration doesn't make you a sellout.","2024-05-02T06:38:14.599811Z"
100.0,35619620,"20111","2024-05-02T06:38:29.551285Z","e6p937d",13.855,"non-belief","But if it lasts longer with less farting... thats means the farts value can be quantified.","2024-05-02T06:38:29.551302Z"
100.0,35619630,"20111","2024-05-02T06:38:32.354149Z","e6sfexq",2.142,"non-belief","I think WWE had/has a trademark on Cody Rhodes, or at least that was his understanding, but not Brandi Rhodes. He mentioned it in an interview a while back (maybe the Talk is Jericho?).

Everyone's going to call him Cody Rhodes, he can't stop it, and there's not much point pretending he's anyone else, but I know he was careful about going by Cody early on in case WWE tried to block him.","2024-05-02T06:38:32.354176Z"
100.0,35619644,"20111","2024-05-02T06:38:35.590712Z","e5tc8yp",2.063,"belief","We did Oklahomas in HS but this right here is player endangerment. I dont care what level you are playing at, this is only a recipe for unneeded head injury. This coaching staff should all be fired and banned from coaching and the school should also pay a fine.","2024-05-02T06:38:35.590732Z"
100.0,35619652,"20111","2024-05-02T06:38:38.449895Z","e6uwwrl",2.123,"belief","I'd like to see some sources for your claims because the assessments I have read so far say that real wages overall are not growing quickly enough, and that the additional GDP growth is not big enough to compensate for the tax cuts. The repatriation of offshore profits have also not amounted to the government revenue increases that were announced by the current administration","2024-05-02T06:38:38.449913Z"
100.0,35619716,"20111","2024-05-02T06:39:03.464220Z","e6x8pck",23.785,"non-belief","So Skyrim was a recounting of the struggle in Microsoft's development team: The Stormcloaks demanded that Talos the 9th be recognized and worshiped but the Imperials bent their conscience to the will of the Thalmor and erased his presence from their domain.","2024-05-02T06:39:03.464242Z"
100.0,35619729,"20111","2024-05-02T06:39:05.812188Z","e6nxt36",1.703,"non-belief","Well, I feel sexual actration to my aunt and cousin. I'm not a degenerate, simply morbidity.
I think that kind of videos are just for feed that morbidity, just like ""muh I fuck my sister in law's ass"".
Too, that are not videos whit many reproductions (I personally find it disgusting).","2024-05-02T06:39:05.812209Z"
100.0,35619749,"20111","2024-05-02T06:39:12.527005Z","e61be56",5.966,"non-belief","Imo great trade, I dont disagree at all","2024-05-02T06:39:12.527024Z"
